{
  "schema": "vbench.pilot_config/1",
  "run_id": "survey-0-1300",
  "source": {
    "key": "BV19D7565EZg-p1",
    "platform": "bilibili",
    "url": "https://www.bilibili.com/video/BV19D7565EZg/",
    "bvid": "BV19D7565EZg",
    "aid": "116815779071505",
    "cid": "39424953454",
    "part": 1,
    "download_formats": {
      "video": "30080",
      "audio": "30280"
    },
    "video_file": "sources/raw/BV19D7565EZg.video.mp4",
    "audio_file": "sources/raw/BV19D7565EZg.audio.m4a"
  },
  "layout": "configs/layout.yuanzhuo-1080p-v1.json",
  "interval": {
    "start": 0,
    "end": 1300,
    "rationale": "Cheap caption/label/board survey (no ASR) to locate where the first mission cycle ends in the edit before choosing the pilot interval."
  },
  "sampling": {
    "coarse_step_frames": 6,
    "guard_period_s": 2.0,
    "diff_pixel_threshold": 40,
    "diff_fraction_threshold": 0.02,
    "thumb_scale": 0.25,
    "reservoir_size": 8,
    "min_ocr_frames": 2
  },
  "captions": {
    "merge_gap_s": 0.35,
    "jitter_cer": 0.25,
    "short_s": 0.4,
    "low_score": 0.8,
    "clean_sample_rate": 0.1
  },
  "ocr": {
    "engine": "rapidocr"
  },
  "asr": {
    "backend": "none"
  },
  "rules": {
    "player_count": 10
  },
  "split": {
    "group_id": "grp-pilot-1",
    "split": "dev"
  },
  "cutoffs": [],
  "speech_events": {
    "enabled": true
  }
}